{
  "$schema": "https://json-schema.org/draft/2020-12/schema",
  "$id": "https://raw.githubusercontent.com/ryan258/the-website-factory/main/schemas/plan.schema.json",
  "title": "AI-drafted website plan",
  "description": "Generated by scripts/schemas.py. Output shape for scripts/draft_plan.py.",
  "type": "object",
  "properties": {
    "name": {
      "type": "string"
    },
    "business": {
      "type": "string"
    },
    "audience": {
      "type": "string"
    },
    "goal": {
      "type": "string"
    },
    "facts": {
      "type": "array",
      "items": {
        "type": "string"
      }
    },
    "unknowns": {
      "type": "array",
      "items": {
        "type": "string"
      }
    },
    "pages": {
      "type": "array",
      "items": {
        "type": "object",
        "properties": {
          "name": {
            "type": "string"
          },
          "purpose": {
            "type": "string"
          },
          "action": {
            "type": "string"
          },
          "sections": {
            "type": "array",
            "items": {
              "type": "object",
              "properties": {
                "kind": {
                  "enum": [
                    "hero",
                    "services",
                    "work",
                    "process",
                    "about",
                    "team",
                    "faq",
                    "pricing",
                    "areas",
                    "testimonials",
                    "stats",
                    "cta",
                    "contact",
                    "resources",
                    "comparison",
                    "before-after",
                    "features",
                    "logos",
                    "timeline",
                    "bento",
                    "preparation",
                    "hours",
                    "visit",
                    "menu",
                    "events",
                    "policies",
                    "glossary",
                    "support",
                    "announcements",
                    "booking",
                    "delivery",
                    "access",
                    "eligibility",
                    "downloads",
                    "specifications",
                    "updates"
                  ]
                },
                "variant": {
                  "type": "string"
                },
                "title": {
                  "type": "string"
                },
                "body": {
                  "type": "string"
                },
                "cta": {
                  "type": "string"
                }
              },
              "required": [
                "kind",
                "variant",
                "title",
                "body",
                "cta"
              ],
              "additionalProperties": false
            }
          }
        },
        "required": [
          "name",
          "purpose",
          "action",
          "sections"
        ],
        "additionalProperties": false
      }
    }
  },
  "required": [
    "name",
    "business",
    "audience",
    "goal",
    "facts",
    "unknowns",
    "pages"
  ],
  "additionalProperties": false
}
